{
  "schemaVersion": "1.0",
  "id": "paper-broker",
  "version": "0.1.1",
  "name": {
    "cn": "模拟券商",
    "en": "Paper Broker"
  },
  "description": {
    "cn": "模拟券商连接器，用于订单演练、组合检查和策略交易测试。",
    "en": "Simulated broker connector for dry-run order execution, portfolio checks, and strategy trading tests."
  },
  "repo": "https://github.com/yeying-community/marketplace/tree/main/tools/packages/paper-broker-mcp",
  "tags": ["community", "broker", "trading", "paper", "simulation"],
  "command": "npx",
  "baseArgs": ["-y", "@yeying-community/paper-broker-mcp", "--transport", "stdio"],
  "configurable": true,
  "configSchema": {
    "properties": {
      "initialCash": {
        "type": "string",
        "description": {
          "cn": "模拟交易初始现金余额，例如 100000。",
          "en": "Initial paper trading cash balance, for example 100000."
        },
        "required": false
      },
      "market": {
        "type": "string",
        "description": {
          "cn": "默认市场范围，例如 CN-A、HK、US 或 CRYPTO。",
          "en": "Default market scope, for example CN-A, HK, US, or CRYPTO."
        },
        "required": false
      },
      "currency": {
        "type": "string",
        "description": {
          "cn": "模拟交易账户币种，例如 USD、CNY 或 HKD。",
          "en": "Paper trading account currency, for example USD, CNY, or HKD."
        },
        "required": false
      },
      "allowShort": {
        "type": "boolean",
        "description": {
          "cn": "模拟卖出订单是否允许开空仓，默认关闭。",
          "en": "Whether simulated sell orders can open short positions. Disabled by default."
        },
        "required": false
      },
      "requireConfirmation": {
        "type": "boolean",
        "description": {
          "cn": "place_order 是否要求用户明确确认后传入 confirmed=true，默认开启。",
          "en": "Whether place_order requires confirmed=true after explicit user confirmation. Enabled by default."
        },
        "required": false
      }
    }
  },
  "argsMapping": {
    "initialCash": {
      "type": "env",
      "key": "PAPER_BROKER_INITIAL_CASH"
    },
    "market": {
      "type": "env",
      "key": "PAPER_BROKER_MARKET"
    },
    "currency": {
      "type": "env",
      "key": "PAPER_BROKER_CURRENCY"
    },
    "allowShort": {
      "type": "env",
      "key": "PAPER_BROKER_ALLOW_SHORT"
    },
    "requireConfirmation": {
      "type": "env",
      "key": "PAPER_BROKER_REQUIRE_CONFIRMATION"
    }
  },
  "release": {
    "status": "published",
    "review": "approved"
  }
}
