{
  "schemaVersion": "1.0",
  "id": "fetch",
  "version": "1.0.0",
  "name": {
    "cn": "网页抓取",
    "en": "Fetch"
  },
  "description": {
    "cn": "抓取并转换网页内容，用于阅读、总结和调研工作流。",
    "en": "Fetch and convert web content for reading, summarization, and research workflows."
  },
  "repo": "https://github.com/modelcontextprotocol/servers/tree/main/src/fetch",
  "tags": ["official", "web", "http"],
  "command": "uvx",
  "baseArgs": ["mcp-server-fetch"],
  "configurable": false,
  "release": {
    "status": "published",
    "review": "approved"
  }
}
