{
  "schemaVersion": "1.0",
  "id": "brave-search",
  "version": "1.0.0",
  "name": "Brave Search",
  "description": "Use Brave Search API for web search and current information retrieval.",
  "repo": "https://github.com/brave/brave-search-mcp-server",
  "tags": ["official", "search", "web"],
  "command": "npx",
  "baseArgs": ["-y", "@brave/brave-search-mcp-server", "--transport", "stdio"],
  "configurable": true,
  "configSchema": {
    "properties": {
      "braveApiKey": {
        "type": "string",
        "description": "Brave Search API Key.",
        "required": true,
        "helpUrl": "https://api-dashboard.search.brave.com/login",
        "helpLabel": "Get API Key"
      }
    }
  },
  "argsMapping": {
    "braveApiKey": {
      "type": "env",
      "key": "BRAVE_API_KEY"
    }
  },
  "release": {
    "status": "published",
    "review": "approved"
  }
}
