{
  "schemaVersion": "1.0",
  "id": "example-mcp",
  "version": "1.0.0",
  "name": {
    "cn": "示例 MCP",
    "en": "Example MCP"
  },
  "description": {
    "cn": "描述这个 MCP 提供什么能力，以及用户什么时候应该安装它。",
    "en": "Describe what this MCP server enables and when users should install it."
  },
  "repo": "https://github.com/example/example-mcp",
  "tags": ["example"],
  "command": "npx",
  "baseArgs": ["-y", "@example/example-mcp"],
  "configurable": false,
  "release": {
    "status": "draft",
    "review": "pending"
  }
}
